{
  "id": "national-employment-support",
  "slug": "national-employment-support",
  "versionId": "national-employment-support-2026-01",
  "officialName": "국민취업지원제도",
  "summary": "구직자에게 취업지원서비스와 유형별 생계·활동비를 지원합니다.",
  "policyType": "service",
  "providerName": "고용노동부",
  "catalogLevel": "rule_ready",
  "effectiveFrom": "2026-01-01",
  "effectiveTo": null,
  "eligibilityRule": { "all": [
    { "field": "jobSeeking", "label": "구직 의사", "op": "eq", "value": true, "reason": "현재 취업을 원하고 있어 취업지원 대상 검토가 가능합니다.", "question": "현재 취업을 원하고 있나요?", "sourceId": "work24-kua" },
    { "field": "age", "label": "참여 연령", "op": "between", "value": [15, 69], "reason": "국민취업지원제도 참여 연령 범위에 해당합니다.", "question": "생년월일은 언제인가요?", "sourceId": "work24-kua" },
    { "any": [
      { "field": "age", "label": "청년 연령", "op": "between", "value": [15, 34], "reason": "청년 대상 Ⅱ유형은 소득·재산과 관계없이 검토할 수 있습니다.", "question": "생년월일은 언제인가요?", "sourceId": "work24-kua" },
      { "field": "householdMedianIncomeRatio", "label": "중장년 가구소득", "op": "lte", "value": 100, "reason": "중장년 Ⅱ유형의 기준 중위소득 조건 범위입니다.", "question": "가구소득은 기준 중위소득의 몇 %인가요?", "sourceId": "work24-kua" }
    ]}
  ]},
  "benefitSummary": "취업지원서비스, 유형에 따라 구직촉진수당 또는 취업활동비용",
  "application": { "officialUrl": "https://www.work24.go.kr/ua/z/z/1300/selectEmssRqutIntro.do", "channels": ["고용24", "고용복지플러스센터"], "confirmationRequired": true },
  "sources": [{ "id": "work24-kua", "title": "국민취업지원제도 취업지원신청", "publisher": "고용24", "url": "https://www.work24.go.kr/ua/z/z/1300/selectEmssRqutIntro.do", "verifiedAt": "2026-07-30", "isPrimary": true }]
}
