{
  "id": "newlywed-jeonse",
  "slug": "newlywed-jeonse",
  "versionId": "newlywed-jeonse-2026-01",
  "officialName": "신혼부부전용 전세자금",
  "summary": "혼인 7년 이내 또는 결혼 예정인 무주택 가구의 전세자금을 지원합니다.",
  "policyType": "loan",
  "providerName": "주택도시기금",
  "catalogLevel": "rule_ready",
  "effectiveFrom": "2026-01-01",
  "effectiveTo": null,
  "eligibilityRule": { "all": [
    { "any": [
      { "field": "isNewlywedWithin7Years", "label": "혼인 7년 이내", "op": "eq", "value": true, "reason": "혼인기간이 7년 이내입니다.", "question": "혼인신고일은 언제인가요?", "sourceId": "nhuf-newlywed-jeonse" },
      { "field": "plannedMarriageWithin3Months", "label": "3개월 이내 결혼 예정", "op": "eq", "value": true, "reason": "3개월 이내 결혼 예정입니다.", "question": "결혼 예정일은 언제인가요?", "sourceId": "nhuf-newlywed-jeonse" }
    ]},
    { "field": "isHouseholdHead", "label": "세대주 또는 예비 세대주", "op": "eq", "value": true, "reason": "세대주 조건을 충족한다고 입력했습니다.", "question": "현재 세대주이거나 대출 실행 전 세대주가 될 예정인가요?", "sourceId": "nhuf-newlywed-jeonse" },
    { "field": "householdHomeCount", "label": "세대원 전원 무주택", "op": "eq", "value": 0, "reason": "세대원 전원이 무주택이라고 입력했습니다.", "question": "본인과 세대원이 소유한 주택은 모두 몇 채인가요?", "sourceId": "nhuf-newlywed-jeonse" },
    { "field": "coupleIncomeAnnual", "label": "부부합산 연소득", "op": "lte", "value": 75000000, "reason": "신혼부부 부부합산 소득 기준 이내입니다.", "question": "본인과 배우자의 연소득은 각각 얼마인가요?", "sourceId": "nhuf-newlywed-jeonse" },
    { "field": "householdNetAssets", "label": "부부합산 순자산", "op": "lte", "value": 345000000, "reason": "2026년 순자산 기준 이내입니다.", "question": "가구 순자산은 얼마인가요?", "sourceId": "nhuf-newlywed-jeonse" },
    { "field": "leaseContract.signed", "label": "임대차계약 체결", "op": "eq", "value": true, "reason": "주택 임대차계약을 체결했습니다.", "question": "주택 임대차계약을 체결했나요?", "sourceId": "nhuf-newlywed-jeonse" }
  ]},
  "benefitSummary": "신혼부부 전세자금 정책대출(실제 금리·한도는 공식 심사에서 확인)",
  "application": { "officialUrl": "https://nhuf.molit.go.kr/FP/FP05/FP0502/FP05020401.jsp", "channels": ["기금e든든", "수탁은행"], "confirmationRequired": true },
  "sources": [{ "id": "nhuf-newlywed-jeonse", "title": "신혼부부전용 전세자금", "publisher": "주택도시기금", "url": "https://nhuf.molit.go.kr/FP/FP05/FP0502/FP05020401.jsp", "verifiedAt": "2026-07-30", "isPrimary": true }]
}
